<?xml version="1.0" encoding="UTF-8"?>
<ns2:Input_Shooting_Schedule xmlns:ns2="http://www.yawlfoundation.org/sb/shootingSchedule" xmlns:xsi="http://www.w3.org/2001/XMLSchema-instance" xsi:schemaLocation="http://www.yawlfoundation.org/sb/shootingSchedule ../shootingScheduleType.xsd ">
  <production>production</production>
  <shootingSchedule>
    <lastUpdatedDate>2001-01-01</lastUpdatedDate>
    <director>director</director>
    <producer>producer</producer>
    <startDate>2001-01-01</startDate>
    <scheduledFinish>2001-01-01</scheduledFinish>
    <revisedFinish>2001-01-01</revisedFinish>
    <scheduledShootingDays>0</scheduledShootingDays>
    <singleDaySchedule>
      <shootDayNo>0</shootDayNo>
      <shootDayDate>2001-01-01</shootDayDate>
      <shootDayWeekday>shootDayWeekday</shootDayWeekday>
      <crewCall>12:00:00</crewCall>
      <travelToLoc>12:00:00</travelToLoc>
      <bumpIn>12:00:00</bumpIn>
      <startDayNotes>startDayNotes</startDayNotes>
      <sceneSchedule>
        <scene>scene</scene>
        <pageTime>
          <number>0</number>
          <numerator>0</numerator>
        </pageTime>
        <D_N>D_N</D_N>
        <IN_EX>IN_EX</IN_EX>
        <locationID>locationID</locationID>
        <set>set</set>
        <address>address</address>
        <synopsis>synopsis</synopsis>
        <characters>
          <character>character</character>
        </characters>
        <estShootTimes>estShootTimes</estShootTimes>
        <estScriptTiming>12:00:00</estScriptTiming>
        <setRequirements>
          <singleEntry>
            <item>item</item>
            <requirements>requirements</requirements>
          </singleEntry>
        </setRequirements>
        <mealBreak>
          <meal>meal</meal>
          <break>break</break>
        </mealBreak>
      </sceneSchedule>
      <endDayNotes>endDayNotes</endDayNotes>
      <totalScriptPages>
        <number>0</number>
        <numerator>0</numerator>
      </totalScriptPages>
    </singleDaySchedule>
  </shootingSchedule>
  <totalScenes>0</totalScenes>
  <totalPageTime>
    <number>0</number>
    <numerator>0</numerator>
  </totalPageTime>
  <originalTiming>12:00:00</originalTiming>
</ns2:Input_Shooting_Schedule>
